{
  "schema_version": "lifetwin.calendar_prefix_request.v1",
  "request_id": "naumann_t40_soc12_5_p10_specialist_demo",
  "model_id": "naumann_calendar_v4_hybrid_development_v1",
  "chemistry": "LFP/graphite",
  "statistical_unit": "temperature_soc_condition_mean_trajectory",
  "temperature_c": 40,
  "storage_soc_fraction": 0.125,
  "requested_coverage": 0.8,
  "prefix": [
    {
      "observation_index": 0,
      "elapsed_days": 0,
      "capacity_retention_pct": 100
    },
    {
      "observation_index": 1,
      "elapsed_days": 6.6804166666666669,
      "capacity_retention_pct": 100.22097775775798
    },
    {
      "observation_index": 2,
      "elapsed_days": 11.540833333333335,
      "capacity_retention_pct": 100.13999275379659
    },
    {
      "observation_index": 3,
      "elapsed_days": 17.041250000000002,
      "capacity_retention_pct": 99.955709486857231
    },
    {
      "observation_index": 4,
      "elapsed_days": 29.504583333333333,
      "capacity_retention_pct": 99.712692247800788
    },
    {
      "observation_index": 5,
      "elapsed_days": 42.045833333333334,
      "capacity_retention_pct": 99.523934387497192
    },
    {
      "observation_index": 6,
      "elapsed_days": 53.56666666666667,
      "capacity_retention_pct": 99.327209883502988
    },
    {
      "observation_index": 7,
      "elapsed_days": 81.041666666666671,
      "capacity_retention_pct": 99.043378103781208
    },
    {
      "observation_index": 8,
      "elapsed_days": 107.46666666666667,
      "capacity_retention_pct": 98.778012080267999
    },
    {
      "observation_index": 9,
      "elapsed_days": 136.94583333333333,
      "capacity_retention_pct": 98.515268592437749
    }
  ],
  "forecast": [
    {
      "forecast_index": 10,
      "elapsed_days": 161.36250000000001
    },
    {
      "forecast_index": 11,
      "elapsed_days": 186.79166666666666
    },
    {
      "forecast_index": 12,
      "elapsed_days": 213.27500000000001
    },
    {
      "forecast_index": 13,
      "elapsed_days": 239.71250000000001
    },
    {
      "forecast_index": 14,
      "elapsed_days": 266.17083333333335
    },
    {
      "forecast_index": 15,
      "elapsed_days": 292.77916666666664
    },
    {
      "forecast_index": 16,
      "elapsed_days": 319.30833333333334
    },
    {
      "forecast_index": 17,
      "elapsed_days": 345.83749999999998
    },
    {
      "forecast_index": 18,
      "elapsed_days": 376.31666666666666
    },
    {
      "forecast_index": 19,
      "elapsed_days": 402.74166666666667
    },
    {
      "forecast_index": 20,
      "elapsed_days": 429.25
    },
    {
      "forecast_index": 21,
      "elapsed_days": 455.79166666666669
    },
    {
      "forecast_index": 22,
      "elapsed_days": 482.29166666666669
    },
    {
      "forecast_index": 23,
      "elapsed_days": 508.79166666666669
    },
    {
      "forecast_index": 24,
      "elapsed_days": 535.16666666666663
    },
    {
      "forecast_index": 25,
      "elapsed_days": 561.70833333333337
    },
    {
      "forecast_index": 26,
      "elapsed_days": 588.29166666666663
    },
    {
      "forecast_index": 27,
      "elapsed_days": 612.29166666666663
    },
    {
      "forecast_index": 28,
      "elapsed_days": 631.16666666666663
    },
    {
      "forecast_index": 29,
      "elapsed_days": 658.79166666666663
    },
    {
      "forecast_index": 30,
      "elapsed_days": 708.375
    },
    {
      "forecast_index": 31,
      "elapsed_days": 759.95833333333337
    },
    {
      "forecast_index": 32,
      "elapsed_days": 799.58333333333337
    },
    {
      "forecast_index": 33,
      "elapsed_days": 840.125
    },
    {
      "forecast_index": 34,
      "elapsed_days": 885.04166666666663
    }
  ]
}
